{
  "$schema": "http://json-schema.org/draft-04/schema#",
  "type": "object",
  "required": [
    "title",
    "description",
    "gadget_definitions",
    "gadget_classes"
  ],
  "properties": {
    "title": {
      "type": "string",
      "minLength": 10
    },
    "description": {
      "type": "string",
      "minLength": 10
    },
    "gadget_definitions": {
      "type": "object",
      "description": "Definitions for all gadgets",
      "required": [
        "client_gadgets",
        "bridge_gadgets"
      ],
      "additionalProperties": false,
      "properties": {
        "client_gadgets": {
          "type": "object",
          "required": [
            "title",
            "description",
            "items"
          ],
          "additionalProperties": false,
          "properties": {
            "title": {
              "type": "string",
              "minLength": 10
            },
            "description": {
              "type": "string",
              "minLength": 10
            },
            "items": {
              "type": "object",
              "description": "Gadgets available to this specific domain",
              "additionalProperties": false,
              "patternProperties": {
                "^[a-z0-9_]+$": {
                  "type": "object",
                  "required": [
                    "name",
                    "description",
                    "enum_value",
                    "ir_required",
                    "radio_required",
                    "class",
                    "config"
                  ],
                  "additionalProperties": false,
                  "properties": {
                    "name": {
                      "type": "string",
                      "minLength": 10
                    },
                    "description": {
                      "type": "string",
                      "minLength": 10
                    },
                    "enum_value": {
                      "type": "integer",
                      "minimum": 0
                    },
                    "ir_required": {
                      "type": "boolean"
                    },
                    "radio_required": {
                      "type": "boolean"
                    },
                    "class": {
                      "type": "integer",
                      "minimum": 0
                    },
                    "config": {
                      "type": "object",
                      "patternProperties": {
                        "^[a-z0-9_]$": {
                          "type": "object",
                          "required": [
                            "type",
                            "optional"
                          ],
                          "properties": {
                            "type": {
                              "type": "string",
                              "enum": [
                                "int",
                                "uint",
                                "string",
                                "float",
                                "bool"
                              ]
                            },
                            "optional": {
                              "type": "boolean"
                            }
                          }
                        }
                      }
                    }
                  }
                }
              }
            }
          }
        },
        "bridge_gadgets": {
          "type": "object",
          "required": [
            "title",
            "description",
            "items"
          ],
          "additionalProperties": false,
          "properties": {
            "title": {
              "type": "string",
              "minLength": 10
            },
            "description": {
              "type": "string",
              "minLength": 10
            },
            "items": {
              "type": "object",
              "description": "Gadgets available to this specific domain",
              "additionalProperties": false,
              "patternProperties": {
                "^[a-z0-9_]+$": {
                  "type": "object",
                  "required": [
                    "name",
                    "description",
                    "class",
                    "enum_value",
                    "config"
                  ],
                  "additionalProperties": false,
                  "properties": {
                    "name": {
                      "type": "string",
                      "minLength": 10
                    },
                    "description": {
                      "type": "string",
                      "minLength": 10
                    },
                    "class": {
                      "type": "integer",
                      "minimum": 0
                    },
                    "enum_value": {
                      "type": "integer",
                      "minimum": 0
                    },
                    "ir_required": {
                      "type": "boolean"
                    },
                    "radio_required": {
                      "type": "boolean"
                    },
                    "config": {
                      "type": "object",
                      "patternProperties": {
                        "^[a-z0-9_]$": {
                          "type": "object",
                          "required": [
                            "type",
                            "optional"
                          ],
                          "properties": {
                            "type": {
                              "type": "string",
                              "enum": [
                                "int",
                                "uint",
                                "string",
                                "float",
                                "bool"
                              ]
                            },
                            "optional": {
                              "type": "boolean"
                            }
                          }
                        }
                      }
                    }
                  }
                }
              }
            }
          }
        }
      }
    },
    "gadget_classes": {
      "type": "object",
      "required": [
        "title",
        "description",
        "items"
      ],
      "additionalProperties": false,
      "properties": {
        "title": {
          "type": "string"
        },
        "description": {
          "type": "string"
        },
        "items": {
          "type": "object",
          "additionalProperties": {
            "type": "object",
            "required": [
              "name",
              "description",
              "enum_value",
              "attributes",
              "sync_attributes"
            ],
            "additionalProperties": false,
            "properties": {
              "name": {
                "type": "string"
              },
              "description": {
                "type": "string"
              },
              "enum_value": {
                "type": "integer",
                "minimum": 0
              },
              "attributes": {
                "type": "string"
              },
              "sync_attributes": {
                "type": "string"
              }
            }
          }
        }
      }
    }
  }
}
